
<!-- XML qui simule une requête de toutes les infos des CV en fonction d'une competence -->

<?xml version="1.0" encoding="UTF-8"?>
<!DOCTYPE question SYSTEM "questions.dtd">
<question typeQuestion="CompFromCv">
    <envoyeur>
        <id>1</id>
        <auteur>magalie</auteur>
        <date>19/10/2022</date>
    </envoyeur>
    <competences>
        <competence>Java</competence>
        <competence>C</competence>
    </competences>
</question>

<!-- XML qui simule une requête de toutes personnes en fonction d'une formation -->

<?xml version="1.0" encoding="UTF-8"?>
<!DOCTYPE question SYSTEM "questions.dtd">
<question typeQuestion="PersFromForma">
    <envoyeur>
        <id>2</id>
        <auteur>lorainne</auteur>
        <date>19/10/2004</date>
    </envoyeur>
    <formations>
        <formation>Ecole de la vie</formation>
    </formations>
</question>